{
  "config_sha256": "6a71c6695e5cf8ec55cdc1c482323712f94de936f25326599a980b176724afc8",
  "digest": "231f2ed4f71f32c7c0b122eb4d74804dca636a0750fd7d8906174c6a31791221",
  "findings": [],
  "schema_version": "1.0",
  "source": "IGNORED",
  "source_sha256": "719a8169ac6eb217a69b1b5c37d9c095fd2d0a3d4b47ed14fcf245616d510057",
  "status": "pass"
}
