{
  "config_sha256": "6a71c6695e5cf8ec55cdc1c482323712f94de936f25326599a980b176724afc8",
  "digest": "c65e10b1fcc6b4d3f01baec6a965adf8d4b3923ea5e833e0ceb61f9238a7f08c",
  "findings": [],
  "schema_version": "1.0",
  "source": "IGNORED",
  "source_sha256": "8b6abd1929a79376e39c3596e2d63b0c48815ee77f3a8956c9fd715da19ffd59",
  "status": "pass"
}
