{
  "config_sha256": "6a71c6695e5cf8ec55cdc1c482323712f94de936f25326599a980b176724afc8",
  "digest": "ad00b834a20434f3be2ff5406afe278a9a64da1fba6bd63b8adf5db703dc62a5",
  "findings": [],
  "schema_version": "1.0",
  "source": "IGNORED",
  "source_sha256": "eb85265c64b67b7ddf411e709942237a1e861b047839fdfb85e1f0b1c3e297ea",
  "status": "pass"
}
