{
  "config_sha256": "6a71c6695e5cf8ec55cdc1c482323712f94de936f25326599a980b176724afc8",
  "digest": "1bc2cf6f5eea1d30d522c8e6ec46bbed0b17152fcd46c14ad5b35599379d6b04",
  "findings": [],
  "schema_version": "1.0",
  "source": "IGNORED",
  "source_sha256": "ecd9922bef9f02053232d94d9fff873c65cf78878c8f2e9d28bb088baed1a7ab",
  "status": "pass"
}
