{
  "config_sha256": "6a71c6695e5cf8ec55cdc1c482323712f94de936f25326599a980b176724afc8",
  "digest": "a17457cb101a3578e86be4b2bf62863b6449dd8f0f5715398b70be394740e444",
  "findings": [],
  "schema_version": "1.0",
  "source": "IGNORED",
  "source_sha256": "cda57d20e1d961f1fbafe60394be25e726399860eb9339fb46089720ecab0dfb",
  "status": "pass"
}
